{
  "questId": 6032,
  "questName": "Meren's Class on the Actual Practice",
  "startStateMachine": {
    "startState": "startQuest",
    "states": [
      {
        "id": "startQuest",
        "type": "genericAction",
        "genericAction": {
          "operations": [
            {"type": "start_quest", "params": {}}
          ],
          "outcomes": [
            {"conditions": [], "nextState": null}
          ]
        }
      }
    ]
  },
  "endStateMachine": {
    "startState": "intro",
    "states": [
      {
        "id": "intro",
        "type": "dialogue",
        "dialogue": {
          "dialogueType": "sendNext",
          "text": "So you've come to attend my class, huh? Right, I'll make it fast.",
          "choices": [
            {"text": "Next", "nextState": "makerMethod"},
            {"text": "Exit", "nextState": null}
          ]
        }
      },
      {
        "id": "makerMethod",
        "type": "dialogue",
        "dialogue": {
          "dialogueType": "sendNextPrev",
          "text": "I will teach you the actual application of the #bMaker#k method. All you need to do is have an item in mind to make, gather all the ingredients from the receipt and mix them in a #rscientifically alchemisty way#k. Easy, isn't it?",
          "choices": [
            {"text": "Previous", "nextState": "intro"},
            {"text": "Next", "nextState": "weightEarringsExample"},
            {"text": "Exit", "nextState": null}
          ]
        }
      },
      {
        "id": "weightEarringsExample",
        "type": "dialogue",
        "dialogue": {
          "dialogueType": "sendNextPrev",
          "text": "Let's take producing the #bWeight Earrings#k as an example. There is a rather specific #rductility theory#k to generate it, as any other 'unique' items have, the name going around the #rmain physical force#k acting over the thing we are working on: on that case, the #bDuctility Theory of Gravity#k (as it is a 'Weighted Earrings', got it?).",
          "choices": [
            {"text": "Previous", "nextState": "makerMethod"},
            {"text": "Next", "nextState": "feeRequest"},
            {"text": "Exit", "nextState": null}
          ]
        }
      },
      {
        "id": "feeRequest",
        "type": "dialogue",
        "dialogue": {
          "dialogueType": "sendNextPrev",
          "text": "Ok, now you need to hand me a fee, 10,000 mesos that is, for that information. The collected fee shall be used for acquiring the needed materials for your learning of the fine art of the #bMaker#k.",
          "choices": [
            {"text": "Previous", "nextState": "weightEarringsExample"},
            {"text": "Next", "nextState": "completeQuest"},
            {"text": "Exit", "nextState": null}
          ]
        }
      },
      {
        "id": "completeQuest",
        "type": "genericAction",
        "genericAction": {
          "operations": [
            {"type": "award_mesos", "params": {"amount": "-10000"}},
            {"type": "complete_quest", "params": {}}
          ],
          "outcomes": [
            {"conditions": [], "nextState": null}
          ]
        }
      }
    ]
  }
}
