{
  "questId": 2325,
  "npcId": 1300008,
  "questName": "Jame's Whereabouts (1)",
  "startStateMachine": {
    "startState": "noStartDialogue",
    "states": [
      {
        "id": "noStartDialogue",
        "type": "dialogue",
        "dialogue": {
          "dialogueType": "sendOk",
          "text": "This quest cannot be started through dialogue.",
          "choices": [
            {"text": "Ok", "nextState": null},
            {"text": "Exit", "nextState": null}
          ]
        }
      }
    ]
  },
  "endStateMachine": {
    "startState": "jamesScared",
    "states": [
      {
        "id": "jamesScared",
        "type": "dialogue",
        "dialogue": {
          "dialogueType": "sendNext",
          "text": "I... I am scared... Please... please help me...",
          "choices": [
            {"text": "Next", "nextState": "playerResponse"},
            {"text": "Exit", "nextState": null}
          ]
        }
      },
      {
        "id": "playerResponse",
        "type": "dialogue",
        "dialogue": {
          "dialogueType": "sendNextPrev",
          "text": "Don't be afriad, #b#p1300005##k sent me here.",
          "speaker": "CHARACTER",
          "choices": [
            {"text": "Previous", "nextState": "jamesScared"},
            {"text": "Next", "nextState": "completeQuest"},
            {"text": "Exit", "nextState": null}
          ]
        }
      },
      {
        "id": "completeQuest",
        "type": "genericAction",
        "genericAction": {
          "operations": [
            {"type": "complete_quest", "params": {}},
            {"type": "award_exp", "params": {"amount": "6000"}}
          ],
          "outcomes": [
            {"conditions": [], "nextState": "thankYou"}
          ]
        }
      },
      {
        "id": "thankYou",
        "type": "dialogue",
        "dialogue": {
          "dialogueType": "sendOk",
          "text": "What? My brother sent you here? Ahhh... I am safe now. Thank you so much...",
          "choices": [
            {"text": "Ok", "nextState": null},
            {"text": "Exit", "nextState": null}
          ]
        }
      }
    ]
  }
}
