{
  "questId": 2321,
  "questName": "Over the Castle Wall (1)",
  "startStateMachine": {
    "startState": "askAccept",
    "states": [
      {
        "id": "askAccept",
        "type": "dialogue",
        "dialogue": {
          "dialogueType": "sendAcceptDecline",
          "text": "Now you'll be able to penetrate the spiny vine barrier of Mushroom Forest, but before that, #bMinister of Home Affairs#k wants to have a word with you. Please go see him immediately.",
          "choices": [
            {"text": "Accept", "nextState": "startQuest"},
            {"text": "Decline", "nextState": "declineMessage"},
            {"text": "Exit", "nextState": null}
          ]
        }
      },
      {
        "id": "declineMessage",
        "type": "dialogue",
        "dialogue": {
          "dialogueType": "sendOk",
          "text": "You don't seem to follow instructions well. Come see me when you are ready.",
          "choices": [
            {"text": "Ok", "nextState": null},
            {"text": "Exit", "nextState": null}
          ]
        }
      },
      {
        "id": "startQuest",
        "type": "genericAction",
        "genericAction": {
          "operations": [
            {"type": "start_quest", "params": {}}
          ],
          "outcomes": [
            {"conditions": [], "nextState": "confirmStart"}
          ]
        }
      },
      {
        "id": "confirmStart",
        "type": "dialogue",
        "dialogue": {
          "dialogueType": "sendOk",
          "text": "Good luck.",
          "choices": [
            {"text": "Ok", "nextState": null},
            {"text": "Exit", "nextState": null}
          ]
        }
      }
    ]
  },
  "endStateMachine": {
    "startState": "congratsMessage",
    "states": [
      {
        "id": "congratsMessage",
        "type": "dialogue",
        "dialogue": {
          "dialogueType": "sendOk",
          "text": "I have been keeping up on your fabulour work. I am aware that you have successfully created the #bKiller Mushroom Spores#k, which penetrates through the unpenetrable barrier of the forest. Congratulations!",
          "choices": [
            {"text": "Ok", "nextState": "completeQuest"},
            {"text": "Exit", "nextState": null}
          ]
        }
      },
      {
        "id": "completeQuest",
        "type": "genericAction",
        "genericAction": {
          "operations": [
            {"type": "complete_quest", "params": {}},
            {"type": "award_exp", "params": {"amount": "2500"}}
          ],
          "outcomes": [
            {"conditions": [], "nextState": "finalMessage"}
          ]
        }
      },
      {
        "id": "finalMessage",
        "type": "dialogue",
        "dialogue": {
          "dialogueType": "sendOk",
          "text": "The problem now is to figure out how to enter the castle.",
          "choices": [
            {"text": "Ok", "nextState": null},
            {"text": "Exit", "nextState": null}
          ]
        }
      }
    ]
  }
}
